{
  "schemaVersion": "0.3.0",
  "id": "source.tokens",
  "revision": "t3",
  "tokens": {
    "border-radius-md": {
      "$type": "dimension",
      "$value": {
        "value": 12,
        "unit": "px"
      }
    },
    "action-bg-primary": {
      "$type": "color",
      "$value": {
        "colorSpace": "srgb",
        "components": [
          0.06666666666666667,
          0.06666666666666667,
          0.06666666666666667
        ],
        "alpha": 1
      },
      "$extensions": {
        "org.full-stack-ds.editor": {
          "eligibility": {
            "roles": [
              "fill"
            ],
            "nodeKinds": [
              "frame"
            ]
          }
        }
      }
    },
    "fg-primary-inverse": {
      "$type": "color",
      "$value": {
        "colorSpace": "srgb",
        "components": [
          1,
          1,
          1
        ],
        "alpha": 1
      }
    }
  }
}
